No.     Time           Source                Destination           Protocol Length Info
      1 0.000000       192.168.31.80         98.86.79.203          TLSv1.2  91     Application Data

Frame 1: 91 bytes on wire (728 bits), 91 bytes captured (728 bits)
Ethernet II, Src: Intel_25:4c:84 (10:91:d1:25:4c:84), Dst: SkyworthDigi_a4:a1:d9 (3c:55:db:a4:a1:d9)
Internet Protocol Version 4, Src: 192.168.31.80, Dst: 98.86.79.203
Transmission Control Protocol, Src Port: 59144, Dst Port: 443, Seq: 1, Ack: 1, Len: 37
Transport Layer Security

No.     Time           Source                Destination           Protocol Length Info
      2 0.013129       192.168.31.80         3.228.250.14          TCP      66     59250 → 443 [SYN] Seq=0 Win=65535 Len=0 MSS=1460 WS=256 SACK_PERM

Frame 2: 66 bytes on wire (528 bits), 66 bytes captured (528 bits)
Ethernet II, Src: Intel_25:4c:84 (10:91:d1:25:4c:84), Dst: SkyworthDigi_a4:a1:d9 (3c:55:db:a4:a1:d9)
Internet Protocol Version 4, Src: 192.168.31.80, Dst: 3.228.250.14
Transmission Control Protocol, Src Port: 59250, Dst Port: 443, Seq: 0, Len: 0

No.     Time           Source                Destination           Protocol Length Info
      3 0.290833       3.228.250.14          192.168.31.80         TCP      66     443 → 59250 [SYN, ACK] Seq=0 Ack=1 Win=26883 Len=0 MSS=1282 SACK_PERM WS=256

Frame 3: 66 bytes on wire (528 bits), 66 bytes captured (528 bits)
Ethernet II, Src: SkyworthDigi_a4:a1:d9 (3c:55:db:a4:a1:d9), Dst: Intel_25:4c:84 (10:91:d1:25:4c:84)
Internet Protocol Version 4, Src: 3.228.250.14, Dst: 192.168.31.80
Transmission Control Protocol, Src Port: 443, Dst Port: 59250, Seq: 0, Ack: 1, Len: 0

No.     Time           Source                Destination           Protocol Length Info
      4 0.290947       192.168.31.80         3.228.250.14          TCP      54     59250 → 443 [ACK] Seq=1 Ack=1 Win=65280 Len=0

Frame 4: 54 bytes on wire (432 bits), 54 bytes captured (432 bits)
Ethernet II, Src: Intel_25:4c:84 (10:91:d1:25:4c:84), Dst: SkyworthDigi_a4:a1:d9 (3c:55:db:a4:a1:d9)
Internet Protocol Version 4, Src: 192.168.31.80, Dst: 3.228.250.14
Transmission Control Protocol, Src Port: 59250, Dst Port: 443, Seq: 1, Ack: 1, Len: 0

No.     Time           Source                Destination           Protocol Length Info
      5 0.291028       98.86.79.203          192.168.31.80         TLSv1.2  87     Application Data

Frame 5: 87 bytes on wire (696 bits), 87 bytes captured (696 bits)
Ethernet II, Src: SkyworthDigi_a4:a1:d9 (3c:55:db:a4:a1:d9), Dst: Intel_25:4c:84 (10:91:d1:25:4c:84)
Internet Protocol Version 4, Src: 98.86.79.203, Dst: 192.168.31.80
Transmission Control Protocol, Src Port: 443, Dst Port: 59144, Seq: 1, Ack: 38, Len: 33
Transport Layer Security

No.     Time           Source                Destination           Protocol Length Info
      6 0.291028       98.86.79.203          192.168.31.80         TLSv1.2  85     Encrypted Alert

Frame 6: 85 bytes on wire (680 bits), 85 bytes captured (680 bits)
Ethernet II, Src: SkyworthDigi_a4:a1:d9 (3c:55:db:a4:a1:d9), Dst: Intel_25:4c:84 (10:91:d1:25:4c:84)
Internet Protocol Version 4, Src: 98.86.79.203, Dst: 192.168.31.80
Transmission Control Protocol, Src Port: 443, Dst Port: 59144, Seq: 34, Ack: 38, Len: 31
Transport Layer Security

No.     Time           Source                Destination           Protocol Length Info
      7 0.291028       98.86.79.203          192.168.31.80         TCP      54     443 → 59144 [FIN, ACK] Seq=65 Ack=38 Win=214 Len=0

Frame 7: 54 bytes on wire (432 bits), 54 bytes captured (432 bits)
Ethernet II, Src: SkyworthDigi_a4:a1:d9 (3c:55:db:a4:a1:d9), Dst: Intel_25:4c:84 (10:91:d1:25:4c:84)
Internet Protocol Version 4, Src: 98.86.79.203, Dst: 192.168.31.80
Transmission Control Protocol, Src Port: 443, Dst Port: 59144, Seq: 65, Ack: 38, Len: 0

No.     Time           Source                Destination           Protocol Length Info
      8 0.291097       192.168.31.80         98.86.79.203          TCP      54     59144 → 443 [ACK] Seq=38 Ack=66 Win=255 Len=0

Frame 8: 54 bytes on wire (432 bits), 54 bytes captured (432 bits)
Ethernet II, Src: Intel_25:4c:84 (10:91:d1:25:4c:84), Dst: SkyworthDigi_a4:a1:d9 (3c:55:db:a4:a1:d9)
Internet Protocol Version 4, Src: 192.168.31.80, Dst: 98.86.79.203
Transmission Control Protocol, Src Port: 59144, Dst Port: 443, Seq: 38, Ack: 66, Len: 0

No.     Time           Source                Destination           Protocol Length Info
      9 0.291434       192.168.31.80         3.228.250.14          TLSv1.2  398    Client Hello (SNI=capi.grammarly.com)

Frame 9: 398 bytes on wire (3184 bits), 398 bytes captured (3184 bits)
Ethernet II, Src: Intel_25:4c:84 (10:91:d1:25:4c:84), Dst: SkyworthDigi_a4:a1:d9 (3c:55:db:a4:a1:d9)
Internet Protocol Version 4, Src: 192.168.31.80, Dst: 3.228.250.14
Transmission Control Protocol, Src Port: 59250, Dst Port: 443, Seq: 1, Ack: 1, Len: 344
Transport Layer Security

No.     Time           Source                Destination           Protocol Length Info
     10 0.291691       192.168.31.80         98.86.79.203          TCP      54     59144 → 443 [RST, ACK] Seq=38 Ack=66 Win=0 Len=0

Frame 10: 54 bytes on wire (432 bits), 54 bytes captured (432 bits)
Ethernet II, Src: Intel_25:4c:84 (10:91:d1:25:4c:84), Dst: SkyworthDigi_a4:a1:d9 (3c:55:db:a4:a1:d9)
Internet Protocol Version 4, Src: 192.168.31.80, Dst: 98.86.79.203
Transmission Control Protocol, Src Port: 59144, Dst Port: 443, Seq: 38, Ack: 66, Len: 0

No.     Time           Source                Destination           Protocol Length Info
     11 0.598345       3.228.250.14          192.168.31.80         TCP      54     443 → 59250 [ACK] Seq=1 Ack=345 Win=28160 Len=0

Frame 11: 54 bytes on wire (432 bits), 54 bytes captured (432 bits)
Ethernet II, Src: SkyworthDigi_a4:a1:d9 (3c:55:db:a4:a1:d9), Dst: Intel_25:4c:84 (10:91:d1:25:4c:84)
Internet Protocol Version 4, Src: 3.228.250.14, Dst: 192.168.31.80
Transmission Control Protocol, Src Port: 443, Dst Port: 59250, Seq: 1, Ack: 345, Len: 0

No.     Time           Source                Destination           Protocol Length Info
     12 0.598345       3.228.250.14          192.168.31.80         TLSv1.2  201    Server Hello, Change Cipher Spec, Encrypted Handshake Message

Frame 12: 201 bytes on wire (1608 bits), 201 bytes captured (1608 bits)
Ethernet II, Src: SkyworthDigi_a4:a1:d9 (3c:55:db:a4:a1:d9), Dst: Intel_25:4c:84 (10:91:d1:25:4c:84)
Internet Protocol Version 4, Src: 3.228.250.14, Dst: 192.168.31.80
Transmission Control Protocol, Src Port: 443, Dst Port: 59250, Seq: 1, Ack: 345, Len: 147
Transport Layer Security

No.     Time           Source                Destination           Protocol Length Info
     13 0.602159       192.168.31.80         3.228.250.14          TLSv1.2  1472   Change Cipher Spec, Encrypted Handshake Message, Application Data

Frame 13: 1472 bytes on wire (11776 bits), 1472 bytes captured (11776 bits)
Ethernet II, Src: Intel_25:4c:84 (10:91:d1:25:4c:84), Dst: SkyworthDigi_a4:a1:d9 (3c:55:db:a4:a1:d9)
Internet Protocol Version 4, Src: 192.168.31.80, Dst: 3.228.250.14
Transmission Control Protocol, Src Port: 59250, Dst Port: 443, Seq: 345, Ack: 148, Len: 1418
Transport Layer Security

No.     Time           Source                Destination           Protocol Length Info
     14 0.905263       3.228.250.14          192.168.31.80         TCP      66     [TCP Dup ACK 11#1] 443 → 59250 [ACK] Seq=148 Ack=345 Win=29184 Len=0 SLE=1627 SRE=1763

Frame 14: 66 bytes on wire (528 bits), 66 bytes captured (528 bits)
Ethernet II, Src: SkyworthDigi_a4:a1:d9 (3c:55:db:a4:a1:d9), Dst: Intel_25:4c:84 (10:91:d1:25:4c:84)
Internet Protocol Version 4, Src: 3.228.250.14, Dst: 192.168.31.80
Transmission Control Protocol, Src Port: 443, Dst Port: 59250, Seq: 148, Ack: 345, Len: 0

No.     Time           Source                Destination           Protocol Length Info
     15 0.905305       3.228.250.14          192.168.31.80         TCP      54     443 → 59250 [ACK] Seq=148 Ack=1763 Win=47104 Len=0

Frame 15: 54 bytes on wire (432 bits), 54 bytes captured (432 bits)
Ethernet II, Src: SkyworthDigi_a4:a1:d9 (3c:55:db:a4:a1:d9), Dst: Intel_25:4c:84 (10:91:d1:25:4c:84)
Internet Protocol Version 4, Src: 3.228.250.14, Dst: 192.168.31.80
Transmission Control Protocol, Src Port: 443, Dst Port: 59250, Seq: 148, Ack: 1763, Len: 0

No.     Time           Source                Destination           Protocol Length Info
     16 0.905305       3.228.250.14          192.168.31.80         TLSv1.2  718    Application Data

Frame 16: 718 bytes on wire (5744 bits), 718 bytes captured (5744 bits)
Ethernet II, Src: SkyworthDigi_a4:a1:d9 (3c:55:db:a4:a1:d9), Dst: Intel_25:4c:84 (10:91:d1:25:4c:84)
Internet Protocol Version 4, Src: 3.228.250.14, Dst: 192.168.31.80
Transmission Control Protocol, Src Port: 443, Dst Port: 59250, Seq: 148, Ack: 1763, Len: 664
Transport Layer Security

No.     Time           Source                Destination           Protocol Length Info
     17 0.916698       192.168.31.80         3.228.250.14          TLSv1.2  1041   Application Data

Frame 17: 1041 bytes on wire (8328 bits), 1041 bytes captured (8328 bits)
Ethernet II, Src: Intel_25:4c:84 (10:91:d1:25:4c:84), Dst: SkyworthDigi_a4:a1:d9 (3c:55:db:a4:a1:d9)
Internet Protocol Version 4, Src: 192.168.31.80, Dst: 3.228.250.14
Transmission Control Protocol, Src Port: 59250, Dst Port: 443, Seq: 1763, Ack: 812, Len: 987
Transport Layer Security

No.     Time           Source                Destination           Protocol Length Info
     18 1.317910       3.228.250.14          192.168.31.80         TCP      54     443 → 59250 [ACK] Seq=812 Ack=2750 Win=65024 Len=0

Frame 18: 54 bytes on wire (432 bits), 54 bytes captured (432 bits)
Ethernet II, Src: SkyworthDigi_a4:a1:d9 (3c:55:db:a4:a1:d9), Dst: Intel_25:4c:84 (10:91:d1:25:4c:84)
Internet Protocol Version 4, Src: 3.228.250.14, Dst: 192.168.31.80
Transmission Control Protocol, Src Port: 443, Dst Port: 59250, Seq: 812, Ack: 2750, Len: 0

No.     Time           Source                Destination           Protocol Length Info
     19 1.357720       3.228.250.14          192.168.31.80         TLSv1.2  891    Application Data

Frame 19: 891 bytes on wire (7128 bits), 891 bytes captured (7128 bits)
Ethernet II, Src: SkyworthDigi_a4:a1:d9 (3c:55:db:a4:a1:d9), Dst: Intel_25:4c:84 (10:91:d1:25:4c:84)
Internet Protocol Version 4, Src: 3.228.250.14, Dst: 192.168.31.80
Transmission Control Protocol, Src Port: 443, Dst Port: 59250, Seq: 812, Ack: 2750, Len: 837
Transport Layer Security

No.     Time           Source                Destination           Protocol Length Info
     20 1.357720       3.228.250.14          192.168.31.80         TLSv1.2  210    Application Data

Frame 20: 210 bytes on wire (1680 bits), 210 bytes captured (1680 bits)
Ethernet II, Src: SkyworthDigi_a4:a1:d9 (3c:55:db:a4:a1:d9), Dst: Intel_25:4c:84 (10:91:d1:25:4c:84)
Internet Protocol Version 4, Src: 3.228.250.14, Dst: 192.168.31.80
Transmission Control Protocol, Src Port: 443, Dst Port: 59250, Seq: 1649, Ack: 2750, Len: 156
Transport Layer Security

No.     Time           Source                Destination           Protocol Length Info
     21 1.357720       3.228.250.14          192.168.31.80         TLSv1.2  213    Application Data

Frame 21: 213 bytes on wire (1704 bits), 213 bytes captured (1704 bits)
Ethernet II, Src: SkyworthDigi_a4:a1:d9 (3c:55:db:a4:a1:d9), Dst: Intel_25:4c:84 (10:91:d1:25:4c:84)
Internet Protocol Version 4, Src: 3.228.250.14, Dst: 192.168.31.80
Transmission Control Protocol, Src Port: 443, Dst Port: 59250, Seq: 1805, Ack: 2750, Len: 159
Transport Layer Security

No.     Time           Source                Destination           Protocol Length Info
     22 1.357771       192.168.31.80         3.228.250.14          TCP      54     59250 → 443 [ACK] Seq=2750 Ack=1964 Win=65280 Len=0

Frame 22: 54 bytes on wire (432 bits), 54 bytes captured (432 bits)
Ethernet II, Src: Intel_25:4c:84 (10:91:d1:25:4c:84), Dst: SkyworthDigi_a4:a1:d9 (3c:55:db:a4:a1:d9)
Internet Protocol Version 4, Src: 192.168.31.80, Dst: 3.228.250.14
Transmission Control Protocol, Src Port: 59250, Dst Port: 443, Seq: 2750, Ack: 1964, Len: 0

No.     Time           Source                Destination           Protocol Length Info
     23 1.359933       192.168.31.80         3.228.250.14          TLSv1.2  140    Application Data

Frame 23: 140 bytes on wire (1120 bits), 140 bytes captured (1120 bits)
Ethernet II, Src: Intel_25:4c:84 (10:91:d1:25:4c:84), Dst: SkyworthDigi_a4:a1:d9 (3c:55:db:a4:a1:d9)
Internet Protocol Version 4, Src: 192.168.31.80, Dst: 3.228.250.14
Transmission Control Protocol, Src Port: 59250, Dst Port: 443, Seq: 2750, Ack: 1964, Len: 86
Transport Layer Security

No.     Time           Source                Destination           Protocol Length Info
     24 1.726068       192.168.31.36         192.168.31.255        UDP      86     40676 → 5775 Len=44

Frame 24: 86 bytes on wire (688 bits), 86 bytes captured (688 bits)
Ethernet II, Src: SkyworthDigi_94:39:86 (3c:55:db:94:39:86), Dst: Broadcast (ff:ff:ff:ff:ff:ff)
Internet Protocol Version 4, Src: 192.168.31.36, Dst: 192.168.31.255
User Datagram Protocol, Src Port: 40676, Dst Port: 5775
Data (44 bytes)

0000  62 65 61 63 6f 6e 3a 52 44 58 53 42 49 4b 42 45   beacon:RDXSBIKBE
0010  32 35 32 38 39 34 3a 30 3a 66 61 6c 73 65 3a 30   252894:0:false:0
0020  3a 31 3a 53 56 3d 31 38 31 30 32 39               :1:SV=181029

No.     Time           Source                Destination           Protocol Length Info
     25 1.726068       3.228.250.14          192.168.31.80         TCP      54     443 → 59250 [ACK] Seq=1964 Ack=2836 Win=65024 Len=0

Frame 25: 54 bytes on wire (432 bits), 54 bytes captured (432 bits)
Ethernet II, Src: SkyworthDigi_a4:a1:d9 (3c:55:db:a4:a1:d9), Dst: Intel_25:4c:84 (10:91:d1:25:4c:84)
Internet Protocol Version 4, Src: 3.228.250.14, Dst: 192.168.31.80
Transmission Control Protocol, Src Port: 443, Dst Port: 59250, Seq: 1964, Ack: 2836, Len: 0

No.     Time           Source                Destination           Protocol Length Info
     26 1.726068       3.228.250.14          192.168.31.80         TLSv1.2  118    Application Data

Frame 26: 118 bytes on wire (944 bits), 118 bytes captured (944 bits)
Ethernet II, Src: SkyworthDigi_a4:a1:d9 (3c:55:db:a4:a1:d9), Dst: Intel_25:4c:84 (10:91:d1:25:4c:84)
Internet Protocol Version 4, Src: 3.228.250.14, Dst: 192.168.31.80
Transmission Control Protocol, Src Port: 443, Dst Port: 59250, Seq: 1964, Ack: 2836, Len: 64
Transport Layer Security

No.     Time           Source                Destination           Protocol Length Info
     27 1.726171       192.168.31.80         3.228.250.14          TLSv1.2  140    Application Data

Frame 27: 140 bytes on wire (1120 bits), 140 bytes captured (1120 bits)
Ethernet II, Src: Intel_25:4c:84 (10:91:d1:25:4c:84), Dst: SkyworthDigi_a4:a1:d9 (3c:55:db:a4:a1:d9)
Internet Protocol Version 4, Src: 192.168.31.80, Dst: 3.228.250.14
Transmission Control Protocol, Src Port: 59250, Dst Port: 443, Seq: 2836, Ack: 2028, Len: 86
Transport Layer Security

No.     Time           Source                Destination           Protocol Length Info
     28 2.031821       3.228.250.14          192.168.31.80         TLSv1.2  118    Application Data

Frame 28: 118 bytes on wire (944 bits), 118 bytes captured (944 bits)
Ethernet II, Src: SkyworthDigi_a4:a1:d9 (3c:55:db:a4:a1:d9), Dst: Intel_25:4c:84 (10:91:d1:25:4c:84)
Internet Protocol Version 4, Src: 3.228.250.14, Dst: 192.168.31.80
Transmission Control Protocol, Src Port: 443, Dst Port: 59250, Seq: 2028, Ack: 2922, Len: 64
Transport Layer Security

No.     Time           Source                Destination           Protocol Length Info
     29 2.086634       192.168.31.80         3.228.250.14          TCP      54     59250 → 443 [ACK] Seq=2922 Ack=2092 Win=65280 Len=0

Frame 29: 54 bytes on wire (432 bits), 54 bytes captured (432 bits)
Ethernet II, Src: Intel_25:4c:84 (10:91:d1:25:4c:84), Dst: SkyworthDigi_a4:a1:d9 (3c:55:db:a4:a1:d9)
Internet Protocol Version 4, Src: 192.168.31.80, Dst: 3.228.250.14
Transmission Control Protocol, Src Port: 59250, Dst Port: 443, Seq: 2922, Ack: 2092, Len: 0

No.     Time           Source                Destination           Protocol Length Info
     30 2.132807       192.168.31.1          224.0.0.1             IGMPv3   50     Membership Query, general

Frame 30: 50 bytes on wire (400 bits), 50 bytes captured (400 bits)
Ethernet II, Src: SkyworthDigi_a4:a1:d9 (3c:55:db:a4:a1:d9), Dst: IPv4mcast_01 (01:00:5e:00:00:01)
Internet Protocol Version 4, Src: 192.168.31.1, Dst: 224.0.0.1
Internet Group Management Protocol

No.     Time           Source                Destination           Protocol Length Info
     31 2.133024       fe80::3e55:dbff:fea4:a1d9 ff02::1               ICMPv6   90     Multicast Listener Query

Frame 31: 90 bytes on wire (720 bits), 90 bytes captured (720 bits)
Ethernet II, Src: SkyworthDigi_a4:a1:d9 (3c:55:db:a4:a1:d9), Dst: IPv6mcast_01 (33:33:00:00:00:01)
Internet Protocol Version 6, Src: fe80::3e55:dbff:fea4:a1d9, Dst: ff02::1
Internet Control Message Protocol v6

No.     Time           Source                Destination           Protocol Length Info
     32 2.133222       fe80::3e55:dbff:fea4:a1d9 ff02::1               ICMPv6   90     Multicast Listener Query

Frame 32: 90 bytes on wire (720 bits), 90 bytes captured (720 bits)
Ethernet II, Src: SkyworthDigi_a4:a1:d9 (3c:55:db:a4:a1:d9), Dst: IPv6mcast_01 (33:33:00:00:00:01)
Internet Protocol Version 6, Src: fe80::3e55:dbff:fea4:a1d9, Dst: ff02::1
Internet Control Message Protocol v6

No.     Time           Source                Destination           Protocol Length Info
     33 2.602020       192.168.31.80         224.0.0.22            IGMPv3   70     Membership Report / Join group 224.0.0.251 for any sources / Join group 224.0.0.252 for any sources / Join group 239.255.255.250 for any sources

Frame 33: 70 bytes on wire (560 bits), 70 bytes captured (560 bits)
Ethernet II, Src: Intel_25:4c:84 (10:91:d1:25:4c:84), Dst: IPv4mcast_16 (01:00:5e:00:00:16)
Internet Protocol Version 4, Src: 192.168.31.80, Dst: 224.0.0.22
Internet Group Management Protocol

No.     Time           Source                Destination           Protocol Length Info
     34 2.602124       fe80::d461:3aa0:6e7c:db02 ff02::16              ICMPv6   130    Multicast Listener Report Message v2

Frame 34: 130 bytes on wire (1040 bits), 130 bytes captured (1040 bits)
Ethernet II, Src: Intel_25:4c:84 (10:91:d1:25:4c:84), Dst: IPv6mcast_16 (33:33:00:00:00:16)
Internet Protocol Version 6, Src: fe80::d461:3aa0:6e7c:db02, Dst: ff02::16
Internet Control Message Protocol v6

No.     Time           Source                Destination           Protocol Length Info
     35 3.103418       fe80::d461:3aa0:6e7c:db02 ff02::16              ICMPv6   110    Multicast Listener Report Message v2

Frame 35: 110 bytes on wire (880 bits), 110 bytes captured (880 bits)
Ethernet II, Src: Intel_25:4c:84 (10:91:d1:25:4c:84), Dst: IPv6mcast_16 (33:33:00:00:00:16)
Internet Protocol Version 6, Src: fe80::d461:3aa0:6e7c:db02, Dst: ff02::16
Internet Control Message Protocol v6

No.     Time           Source                Destination           Protocol Length Info
     36 3.604434       fe80::d461:3aa0:6e7c:db02 ff02::16              ICMPv6   90     Multicast Listener Report Message v2

Frame 36: 90 bytes on wire (720 bits), 90 bytes captured (720 bits)
Ethernet II, Src: Intel_25:4c:84 (10:91:d1:25:4c:84), Dst: IPv6mcast_16 (33:33:00:00:00:16)
Internet Protocol Version 6, Src: fe80::d461:3aa0:6e7c:db02, Dst: ff02::16
Internet Control Message Protocol v6

No.     Time           Source                Destination           Protocol Length Info
     37 3.662703       192.168.31.80         192.168.31.1          DNS      85     Standard query 0xe3a3 A analytics.apis.mcafee.com

Frame 37: 85 bytes on wire (680 bits), 85 bytes captured (680 bits)
Ethernet II, Src: Intel_25:4c:84 (10:91:d1:25:4c:84), Dst: SkyworthDigi_a4:a1:d9 (3c:55:db:a4:a1:d9)
Internet Protocol Version 4, Src: 192.168.31.80, Dst: 192.168.31.1
User Datagram Protocol, Src Port: 52778, Dst Port: 53
Domain Name System (query)

No.     Time           Source                Destination           Protocol Length Info
     38 3.663567       192.168.31.80         192.168.31.1          DNS      85     Standard query 0x7ab1 AAAA analytics.apis.mcafee.com

Frame 38: 85 bytes on wire (680 bits), 85 bytes captured (680 bits)
Ethernet II, Src: Intel_25:4c:84 (10:91:d1:25:4c:84), Dst: SkyworthDigi_a4:a1:d9 (3c:55:db:a4:a1:d9)
Internet Protocol Version 4, Src: 192.168.31.80, Dst: 192.168.31.1
User Datagram Protocol, Src Port: 61029, Dst Port: 53
Domain Name System (query)

No.     Time           Source                Destination           Protocol Length Info
     39 3.696009       192.168.31.1          192.168.31.80         DNS      239    Standard query response 0xe3a3 A analytics.apis.mcafee.com CNAME mosaic-orio.apis.mcafee.com A 34.214.102.228 A 52.40.105.29 A 54.148.26.36 A 52.36.91.43 A 100.20.113.244 A 35.165.138.174 A 54.148.162.49 A 34.213.2.180

Frame 39: 239 bytes on wire (1912 bits), 239 bytes captured (1912 bits)
Ethernet II, Src: 2a:c8:f0:8f:a1:43 (2a:c8:f0:8f:a1:43), Dst: Intel_25:4c:84 (10:91:d1:25:4c:84)
Internet Protocol Version 4, Src: 192.168.31.1, Dst: 192.168.31.80
User Datagram Protocol, Src Port: 53, Dst Port: 52778
Domain Name System (response)

No.     Time           Source                Destination           Protocol Length Info
     40 3.704175       192.168.31.1          192.168.31.80         DNS      193    Standard query response 0x7ab1 AAAA analytics.apis.mcafee.com CNAME mosaic-orio.apis.mcafee.com SOA ns-1222.awsdns-24.org

Frame 40: 193 bytes on wire (1544 bits), 193 bytes captured (1544 bits)
Ethernet II, Src: 2a:c8:f0:8f:a1:43 (2a:c8:f0:8f:a1:43), Dst: Intel_25:4c:84 (10:91:d1:25:4c:84)
Internet Protocol Version 4, Src: 192.168.31.1, Dst: 192.168.31.80
User Datagram Protocol, Src Port: 53, Dst Port: 61029
Domain Name System (response)

No.     Time           Source                Destination           Protocol Length Info
     41 3.705704       192.168.31.80         34.214.102.228        TCP      66     59251 → 443 [SYN] Seq=0 Win=65535 Len=0 MSS=1460 WS=256 SACK_PERM

Frame 41: 66 bytes on wire (528 bits), 66 bytes captured (528 bits)
Ethernet II, Src: Intel_25:4c:84 (10:91:d1:25:4c:84), Dst: SkyworthDigi_a4:a1:d9 (3c:55:db:a4:a1:d9)
Internet Protocol Version 4, Src: 192.168.31.80, Dst: 34.214.102.228
Transmission Control Protocol, Src Port: 59251, Dst Port: 443, Seq: 0, Len: 0

No.     Time           Source                Destination           Protocol Length Info
     42 3.719484       192.168.31.36         192.168.31.255        UDP      86     40676 → 5775 Len=44

Frame 42: 86 bytes on wire (688 bits), 86 bytes captured (688 bits)
Ethernet II, Src: SkyworthDigi_94:39:86 (3c:55:db:94:39:86), Dst: Broadcast (ff:ff:ff:ff:ff:ff)
Internet Protocol Version 4, Src: 192.168.31.36, Dst: 192.168.31.255
User Datagram Protocol, Src Port: 40676, Dst Port: 5775
Data (44 bytes)

0000  62 65 61 63 6f 6e 3a 52 44 58 53 42 49 4b 42 45   beacon:RDXSBIKBE
0010  32 35 32 38 39 34 3a 30 3a 66 61 6c 73 65 3a 30   252894:0:false:0
0020  3a 31 3a 53 56 3d 31 38 31 30 32 39               :1:SV=181029

No.     Time           Source                Destination           Protocol Length Info
     43 4.079731       34.214.102.228        192.168.31.80         TCP      66     443 → 59251 [SYN, ACK] Seq=0 Ack=1 Win=26883 Len=0 MSS=1282 SACK_PERM WS=256

Frame 43: 66 bytes on wire (528 bits), 66 bytes captured (528 bits)
Ethernet II, Src: SkyworthDigi_a4:a1:d9 (3c:55:db:a4:a1:d9), Dst: Intel_25:4c:84 (10:91:d1:25:4c:84)
Internet Protocol Version 4, Src: 34.214.102.228, Dst: 192.168.31.80
Transmission Control Protocol, Src Port: 443, Dst Port: 59251, Seq: 0, Ack: 1, Len: 0

No.     Time           Source                Destination           Protocol Length Info
     44 4.079900       192.168.31.80         34.214.102.228        TCP      54     59251 → 443 [ACK] Seq=1 Ack=1 Win=65280 Len=0

Frame 44: 54 bytes on wire (432 bits), 54 bytes captured (432 bits)
Ethernet II, Src: Intel_25:4c:84 (10:91:d1:25:4c:84), Dst: SkyworthDigi_a4:a1:d9 (3c:55:db:a4:a1:d9)
Internet Protocol Version 4, Src: 192.168.31.80, Dst: 34.214.102.228
Transmission Control Protocol, Src Port: 59251, Dst Port: 443, Seq: 1, Ack: 1, Len: 0

No.     Time           Source                Destination           Protocol Length Info
     45 4.081141       192.168.31.80         34.214.102.228        TLSv1.2  262    Client Hello (SNI=analytics.apis.mcafee.com)

Frame 45: 262 bytes on wire (2096 bits), 262 bytes captured (2096 bits)
Ethernet II, Src: Intel_25:4c:84 (10:91:d1:25:4c:84), Dst: SkyworthDigi_a4:a1:d9 (3c:55:db:a4:a1:d9)
Internet Protocol Version 4, Src: 192.168.31.80, Dst: 34.214.102.228
Transmission Control Protocol, Src Port: 59251, Dst Port: 443, Seq: 1, Ack: 1, Len: 208
Transport Layer Security

No.     Time           Source                Destination           Protocol Length Info
     46 4.387053       34.214.102.228        192.168.31.80         TCP      54     443 → 59251 [ACK] Seq=1 Ack=209 Win=28160 Len=0

Frame 46: 54 bytes on wire (432 bits), 54 bytes captured (432 bits)
Ethernet II, Src: SkyworthDigi_a4:a1:d9 (3c:55:db:a4:a1:d9), Dst: Intel_25:4c:84 (10:91:d1:25:4c:84)
Internet Protocol Version 4, Src: 34.214.102.228, Dst: 192.168.31.80
Transmission Control Protocol, Src Port: 443, Dst Port: 59251, Seq: 1, Ack: 209, Len: 0

No.     Time           Source                Destination           Protocol Length Info
     47 4.387053       34.214.102.228        192.168.31.80         TLSv1.2  3840   Server Hello

Frame 47: 3840 bytes on wire (30720 bits), 3840 bytes captured (30720 bits)
Ethernet II, Src: SkyworthDigi_a4:a1:d9 (3c:55:db:a4:a1:d9), Dst: Intel_25:4c:84 (10:91:d1:25:4c:84)
Internet Protocol Version 4, Src: 34.214.102.228, Dst: 192.168.31.80
Transmission Control Protocol, Src Port: 443, Dst Port: 59251, Seq: 1, Ack: 209, Len: 3786
Transport Layer Security

No.     Time           Source                Destination           Protocol Length Info
     48 4.387053       34.214.102.228        192.168.31.80         TLSv1.2  519    Certificate, Server Key Exchange, Server Hello Done

Frame 48: 519 bytes on wire (4152 bits), 519 bytes captured (4152 bits)
Ethernet II, Src: SkyworthDigi_a4:a1:d9 (3c:55:db:a4:a1:d9), Dst: Intel_25:4c:84 (10:91:d1:25:4c:84)
Internet Protocol Version 4, Src: 34.214.102.228, Dst: 192.168.31.80
Transmission Control Protocol, Src Port: 443, Dst Port: 59251, Seq: 3787, Ack: 209, Len: 465
[2 Reassembled TCP Segments (3824 bytes): #47(3673), #48(151)]
Transport Layer Security
Transport Layer Security

No.     Time           Source                Destination           Protocol Length Info
     49 4.387185       192.168.31.80         34.214.102.228        TCP      54     59251 → 443 [ACK] Seq=209 Ack=4252 Win=65280 Len=0

Frame 49: 54 bytes on wire (432 bits), 54 bytes captured (432 bits)
Ethernet II, Src: Intel_25:4c:84 (10:91:d1:25:4c:84), Dst: SkyworthDigi_a4:a1:d9 (3c:55:db:a4:a1:d9)
Internet Protocol Version 4, Src: 192.168.31.80, Dst: 34.214.102.228
Transmission Control Protocol, Src Port: 59251, Dst Port: 443, Seq: 209, Ack: 4252, Len: 0

No.     Time           Source                Destination           Protocol Length Info
     50 4.392958       192.168.31.80         34.214.102.228        TLSv1.2  147    Client Key Exchange, Change Cipher Spec, Encrypted Handshake Message

Frame 50: 147 bytes on wire (1176 bits), 147 bytes captured (1176 bits)
Ethernet II, Src: Intel_25:4c:84 (10:91:d1:25:4c:84), Dst: SkyworthDigi_a4:a1:d9 (3c:55:db:a4:a1:d9)
Internet Protocol Version 4, Src: 192.168.31.80, Dst: 34.214.102.228
Transmission Control Protocol, Src Port: 59251, Dst Port: 443, Seq: 209, Ack: 4252, Len: 93
Transport Layer Security

No.     Time           Source                Destination           Protocol Length Info
     51 4.509685       2409:40f2:148:96e7:8d9b:a3d2:93d2:d9e4 2606:4700:83b2:7db9:22dd:4ca:5ff2:75c4 TCP      75     58944 → 443 [ACK] Seq=1 Ack=1 Win=254 Len=1

Frame 51: 75 bytes on wire (600 bits), 75 bytes captured (600 bits)
Ethernet II, Src: Intel_25:4c:84 (10:91:d1:25:4c:84), Dst: SkyworthDigi_a4:a1:d9 (3c:55:db:a4:a1:d9)
Internet Protocol Version 6, Src: 2409:40f2:148:96e7:8d9b:a3d2:93d2:d9e4, Dst: 2606:4700:83b2:7db9:22dd:4ca:5ff2:75c4
Transmission Control Protocol, Src Port: 58944, Dst Port: 443, Seq: 1, Ack: 1, Len: 1

No.     Time           Source                Destination           Protocol Length Info
     52 4.567959       2606:4700:83b2:7db9:22dd:4ca:5ff2:75c4 2409:40f2:148:96e7:8d9b:a3d2:93d2:d9e4 TCP      90     443 → 58944 [ACK] Seq=1 Ack=2 Win=360 Len=0 SLE=1 SRE=2

Frame 52: 90 bytes on wire (720 bits), 90 bytes captured (720 bits)
Ethernet II, Src: SkyworthDigi_a4:a1:d9 (3c:55:db:a4:a1:d9), Dst: Intel_25:4c:84 (10:91:d1:25:4c:84)
802.1Q Virtual LAN, PRI: 0, DEI: 0, ID: 0
Internet Protocol Version 6, Src: 2606:4700:83b2:7db9:22dd:4ca:5ff2:75c4, Dst: 2409:40f2:148:96e7:8d9b:a3d2:93d2:d9e4
Transmission Control Protocol, Src Port: 443, Dst Port: 58944, Seq: 1, Ack: 2, Len: 0

No.     Time           Source                Destination           Protocol Length Info
     53 4.695752       34.214.102.228        192.168.31.80         TCP      54     443 → 59251 [ACK] Seq=4252 Ack=302 Win=28160 Len=0

Frame 53: 54 bytes on wire (432 bits), 54 bytes captured (432 bits)
Ethernet II, Src: SkyworthDigi_a4:a1:d9 (3c:55:db:a4:a1:d9), Dst: Intel_25:4c:84 (10:91:d1:25:4c:84)
Internet Protocol Version 4, Src: 34.214.102.228, Dst: 192.168.31.80
Transmission Control Protocol, Src Port: 443, Dst Port: 59251, Seq: 4252, Ack: 302, Len: 0

No.     Time           Source                Destination           Protocol Length Info
     54 4.695752       34.214.102.228        192.168.31.80         TLSv1.2  258    New Session Ticket, Change Cipher Spec, Encrypted Handshake Message

Frame 54: 258 bytes on wire (2064 bits), 258 bytes captured (2064 bits)
Ethernet II, Src: SkyworthDigi_a4:a1:d9 (3c:55:db:a4:a1:d9), Dst: Intel_25:4c:84 (10:91:d1:25:4c:84)
Internet Protocol Version 4, Src: 34.214.102.228, Dst: 192.168.31.80
Transmission Control Protocol, Src Port: 443, Dst Port: 59251, Seq: 4252, Ack: 302, Len: 204
Transport Layer Security

No.     Time           Source                Destination           Protocol Length Info
     55 4.695752       34.214.102.228        192.168.31.80         TLSv1.2  123    Application Data

Frame 55: 123 bytes on wire (984 bits), 123 bytes captured (984 bits)
Ethernet II, Src: SkyworthDigi_a4:a1:d9 (3c:55:db:a4:a1:d9), Dst: Intel_25:4c:84 (10:91:d1:25:4c:84)
Internet Protocol Version 4, Src: 34.214.102.228, Dst: 192.168.31.80
Transmission Control Protocol, Src Port: 443, Dst Port: 59251, Seq: 4456, Ack: 302, Len: 69
Transport Layer Security

No.     Time           Source                Destination           Protocol Length Info
     56 4.695872       192.168.31.80         34.214.102.228        TCP      54     59251 → 443 [ACK] Seq=302 Ack=4525 Win=65024 Len=0

Frame 56: 54 bytes on wire (432 bits), 54 bytes captured (432 bits)
Ethernet II, Src: Intel_25:4c:84 (10:91:d1:25:4c:84), Dst: SkyworthDigi_a4:a1:d9 (3c:55:db:a4:a1:d9)
Internet Protocol Version 4, Src: 192.168.31.80, Dst: 34.214.102.228
Transmission Control Protocol, Src Port: 59251, Dst Port: 443, Seq: 302, Ack: 4525, Len: 0

No.     Time           Source                Destination           Protocol Length Info
     57 4.702242       192.168.31.80         34.214.102.228        TLSv1.2  141    Application Data

Frame 57: 141 bytes on wire (1128 bits), 141 bytes captured (1128 bits)
Ethernet II, Src: Intel_25:4c:84 (10:91:d1:25:4c:84), Dst: SkyworthDigi_a4:a1:d9 (3c:55:db:a4:a1:d9)
Internet Protocol Version 4, Src: 192.168.31.80, Dst: 34.214.102.228
Transmission Control Protocol, Src Port: 59251, Dst Port: 443, Seq: 302, Ack: 4525, Len: 87
Transport Layer Security

No.     Time           Source                Destination           Protocol Length Info
     58 4.702553       192.168.31.80         34.214.102.228        TLSv1.2  490    Application Data

Frame 58: 490 bytes on wire (3920 bits), 490 bytes captured (3920 bits)
Ethernet II, Src: Intel_25:4c:84 (10:91:d1:25:4c:84), Dst: SkyworthDigi_a4:a1:d9 (3c:55:db:a4:a1:d9)
Internet Protocol Version 4, Src: 192.168.31.80, Dst: 34.214.102.228
Transmission Control Protocol, Src Port: 59251, Dst Port: 443, Seq: 389, Ack: 4525, Len: 436
Transport Layer Security

No.     Time           Source                Destination           Protocol Length Info
     59 4.702720       192.168.31.80         34.214.102.228        TLSv1.2  92     Application Data

Frame 59: 92 bytes on wire (736 bits), 92 bytes captured (736 bits)
Ethernet II, Src: Intel_25:4c:84 (10:91:d1:25:4c:84), Dst: SkyworthDigi_a4:a1:d9 (3c:55:db:a4:a1:d9)
Internet Protocol Version 4, Src: 192.168.31.80, Dst: 34.214.102.228
Transmission Control Protocol, Src Port: 59251, Dst Port: 443, Seq: 825, Ack: 4525, Len: 38
Transport Layer Security

No.     Time           Source                Destination           Protocol Length Info
     60 4.702805       192.168.31.80         34.214.102.228        TLSv1.2  770    Application Data

Frame 60: 770 bytes on wire (6160 bits), 770 bytes captured (6160 bits)
Ethernet II, Src: Intel_25:4c:84 (10:91:d1:25:4c:84), Dst: SkyworthDigi_a4:a1:d9 (3c:55:db:a4:a1:d9)
Internet Protocol Version 4, Src: 192.168.31.80, Dst: 34.214.102.228
Transmission Control Protocol, Src Port: 59251, Dst Port: 443, Seq: 863, Ack: 4525, Len: 716
Transport Layer Security

No.     Time           Source                Destination           Protocol Length Info
     61 5.001607       34.214.102.228        192.168.31.80         TLSv1.2  92     Application Data

Frame 61: 92 bytes on wire (736 bits), 92 bytes captured (736 bits)
Ethernet II, Src: SkyworthDigi_a4:a1:d9 (3c:55:db:a4:a1:d9), Dst: Intel_25:4c:84 (10:91:d1:25:4c:84)
Internet Protocol Version 4, Src: 34.214.102.228, Dst: 192.168.31.80
Transmission Control Protocol, Src Port: 443, Dst Port: 59251, Seq: 4525, Ack: 389, Len: 38
Transport Layer Security

No.     Time           Source                Destination           Protocol Length Info
     62 5.001607       34.214.102.228        192.168.31.80         TCP      54     443 → 59251 [ACK] Seq=4563 Ack=1579 Win=30464 Len=0

Frame 62: 54 bytes on wire (432 bits), 54 bytes captured (432 bits)
Ethernet II, Src: SkyworthDigi_a4:a1:d9 (3c:55:db:a4:a1:d9), Dst: Intel_25:4c:84 (10:91:d1:25:4c:84)
Internet Protocol Version 4, Src: 34.214.102.228, Dst: 192.168.31.80
Transmission Control Protocol, Src Port: 443, Dst Port: 59251, Seq: 4563, Ack: 1579, Len: 0

No.     Time           Source                Destination           Protocol Length Info
     63 5.001607       34.214.102.228        192.168.31.80         TLSv1.2  147    Application Data

Frame 63: 147 bytes on wire (1176 bits), 147 bytes captured (1176 bits)
Ethernet II, Src: SkyworthDigi_a4:a1:d9 (3c:55:db:a4:a1:d9), Dst: Intel_25:4c:84 (10:91:d1:25:4c:84)
Internet Protocol Version 4, Src: 34.214.102.228, Dst: 192.168.31.80
Transmission Control Protocol, Src Port: 443, Dst Port: 59251, Seq: 4563, Ack: 1579, Len: 93
Transport Layer Security

No.     Time           Source                Destination           Protocol Length Info
     64 5.001607       34.214.102.228        192.168.31.80         TLSv1.2  92     Application Data

Frame 64: 92 bytes on wire (736 bits), 92 bytes captured (736 bits)
Ethernet II, Src: SkyworthDigi_a4:a1:d9 (3c:55:db:a4:a1:d9), Dst: Intel_25:4c:84 (10:91:d1:25:4c:84)
Internet Protocol Version 4, Src: 34.214.102.228, Dst: 192.168.31.80
Transmission Control Protocol, Src Port: 443, Dst Port: 59251, Seq: 4656, Ack: 1579, Len: 38
Transport Layer Security

No.     Time           Source                Destination           Protocol Length Info
     65 5.001774       192.168.31.80         34.214.102.228        TCP      54     59251 → 443 [ACK] Seq=1579 Ack=4694 Win=65024 Len=0

Frame 65: 54 bytes on wire (432 bits), 54 bytes captured (432 bits)
Ethernet II, Src: Intel_25:4c:84 (10:91:d1:25:4c:84), Dst: SkyworthDigi_a4:a1:d9 (3c:55:db:a4:a1:d9)
Internet Protocol Version 4, Src: 192.168.31.80, Dst: 34.214.102.228
Transmission Control Protocol, Src Port: 59251, Dst Port: 443, Seq: 1579, Ack: 4694, Len: 0

No.     Time           Source                Destination           Protocol Length Info
     66 5.002764       192.168.31.80         34.214.102.228        TCP      54     59251 → 443 [FIN, ACK] Seq=1579 Ack=4694 Win=65024 Len=0

Frame 66: 54 bytes on wire (432 bits), 54 bytes captured (432 bits)
Ethernet II, Src: Intel_25:4c:84 (10:91:d1:25:4c:84), Dst: SkyworthDigi_a4:a1:d9 (3c:55:db:a4:a1:d9)
Internet Protocol Version 4, Src: 192.168.31.80, Dst: 34.214.102.228
Transmission Control Protocol, Src Port: 59251, Dst Port: 443, Seq: 1579, Ack: 4694, Len: 0

No.     Time           Source                Destination           Protocol Length Info
     67 5.014503       192.168.31.80         34.214.102.228        TCP      66     59252 → 443 [SYN] Seq=0 Win=65535 Len=0 MSS=1460 WS=256 SACK_PERM

Frame 67: 66 bytes on wire (528 bits), 66 bytes captured (528 bits)
Ethernet II, Src: Intel_25:4c:84 (10:91:d1:25:4c:84), Dst: SkyworthDigi_a4:a1:d9 (3c:55:db:a4:a1:d9)
Internet Protocol Version 4, Src: 192.168.31.80, Dst: 34.214.102.228
Transmission Control Protocol, Src Port: 59252, Dst Port: 443, Seq: 0, Len: 0

No.     Time           Source                Destination           Protocol Length Info
     68 5.308530       34.214.102.228        192.168.31.80         TLSv1.2  85     Encrypted Alert

Frame 68: 85 bytes on wire (680 bits), 85 bytes captured (680 bits)
Ethernet II, Src: SkyworthDigi_a4:a1:d9 (3c:55:db:a4:a1:d9), Dst: Intel_25:4c:84 (10:91:d1:25:4c:84)
Internet Protocol Version 4, Src: 34.214.102.228, Dst: 192.168.31.80
Transmission Control Protocol, Src Port: 443, Dst Port: 59251, Seq: 4694, Ack: 1580, Len: 31
Transport Layer Security

No.     Time           Source                Destination           Protocol Length Info
     69 5.308530       34.214.102.228        192.168.31.80         TCP      54     443 → 59251 [FIN, ACK] Seq=4725 Ack=1580 Win=30464 Len=0

Frame 69: 54 bytes on wire (432 bits), 54 bytes captured (432 bits)
Ethernet II, Src: SkyworthDigi_a4:a1:d9 (3c:55:db:a4:a1:d9), Dst: Intel_25:4c:84 (10:91:d1:25:4c:84)
Internet Protocol Version 4, Src: 34.214.102.228, Dst: 192.168.31.80
Transmission Control Protocol, Src Port: 443, Dst Port: 59251, Seq: 4725, Ack: 1580, Len: 0

No.     Time           Source                Destination           Protocol Length Info
     70 5.308530       34.214.102.228        192.168.31.80         TCP      66     443 → 59252 [SYN, ACK] Seq=0 Ack=1 Win=26883 Len=0 MSS=1282 SACK_PERM WS=256

Frame 70: 66 bytes on wire (528 bits), 66 bytes captured (528 bits)
Ethernet II, Src: SkyworthDigi_a4:a1:d9 (3c:55:db:a4:a1:d9), Dst: Intel_25:4c:84 (10:91:d1:25:4c:84)
Internet Protocol Version 4, Src: 34.214.102.228, Dst: 192.168.31.80
Transmission Control Protocol, Src Port: 443, Dst Port: 59252, Seq: 0, Ack: 1, Len: 0

No.     Time           Source                Destination           Protocol Length Info
